{
  "INTENT_TYPE": "PILOTE_EXECUTION_INTENT_V1",
  "INTENT_VERSION": "1.0.0",
  "INPUT_MODE": "NATIVE_REV51",
  "CANONICALIZATION_ID": "ATELIER_EXECUTION_CANONICAL_JSON_V1",
  "PROJECT_ID": "ATELIER-PILOTE",
  "PHASE_ID": "R42-P2P3",
  "TASK_ID": "R42-FIXTURE-READ-001",
  "TASK_CONTRACT_SHA256": "d2fb156b45cb2f78f97e1550b2c972ada5e739ae0477fdc2944cb8e5b23ddb66",
  "EXECUTION_PATH_POLICY": "RUNTIME_DECIDES",
  "CAPABILITY_REQUIREMENTS": [
    "SOURCE_READ"
  ],
  "RESOURCE_INTENT": {
    "CPU_MIN_MILLICORES": null,
    "MEMORY_MIN_MIB": null,
    "DISK_MIN_MIB": null,
    "GPU_COUNT": null,
    "GPU_MEMORY_MIN_MIB": null,
    "GPU_CAPABILITY_CLASS": null
  },
  "SECURITY_REQUIREMENT": {
    "ISOLATION_CLASS": "DEFAULT",
    "NETWORK_CLASS": "INHERIT_TASK",
    "DATA_ACCESS_CLASS": "INHERIT_TASK",
    "SECRET_CLASS": "INHERIT_TASK"
  },
  "BUDGET_INTENT": {
    "MAX_RUNTIME_SECONDS": null,
    "MAX_COST_MICRO_USD": null
  },
  "CHECKPOINT_POLICY": "NOT_REQUESTED",
  "CACHE_POLICY": "NOT_REQUESTED",
  "DATA_LOCALITY_POLICY": "NONE",
  "VERIFIER_POLICY_REF": {
    "ID": "verifier.runtime.required",
    "VERSION": "1.0.0",
    "SHA256": "2222222222222222222222222222222222222222222222222222222222222222"
  },
  "ACCEPTANCE_REQUIREMENT_REF": "task-contract:ACCEPTANCE_REQUIREMENTS",
  "APPROVAL_BOUNDARY": {
    "MODE": "INHERIT_TASK",
    "EFFECT_CLASS_REFS": [
      "READ_ONLY"
    ],
    "SCOPE_REFS": [
      "repo:neoflowcore/atelier-runtime"
    ]
  },
  "OPERATOR_POLICY": "ZERO_TOUCH_AFTER_APPROVAL",
  "SEMANTIC_DEPENDENCY_REFS": [],
  "PARALLELISM_INTENT": "INHERIT_DAG",
  "EXPECTED_OUTPUT_CLASSES": [
    "TASK_DECLARED_OUTPUTS"
  ],
  "EXPECTED_EVIDENCE_CLASSES": [
    "TASK_DECLARED_EVIDENCE"
  ],
  "CONTRACT_SET_REF": {
    "ID": "ATELIER_REV51_CONTRACT_SET_V1",
    "VERSION": "1.0.0",
    "SHA256": "a8b220c92a47306061e9aca1c65077d357b00bda12e9daad4f37215256083f4a"
  },
  "INTENT_SHA256": "68f231d23a0181ee08bab90df8619ae8b4e8c8ba9ba57ccbe1fa02d75069127e"
}
